{"schema_version":"0.3.0-draft","snapshot_id":"plus-ai-native-slides__2026-09-09","workflow_id":"plus-ai-native-slides","name":"Plus AI 在 Google Slides / PowerPoint 内生成与改写","observed_at":"2026-09-09T00:00:00Z","status":"documented","source_refs":["https://workspace.google.com/marketplace/app/plus_ai_for_google_slides_and_docs/214277172452","https://www.youtube.com/watch?v=sXx98CpKR9w"],"steps":[{"order":1,"action":"在 Google Slides 或 PowerPoint 中从提示词或文档生成整套演示","actor":"mixed","component":"Plus AI","estimated_minutes":null},{"order":2,"action":"插入单页、改写内容或重排现有页面","actor":"mixed","component":"Plus AI","estimated_minutes":null},{"order":3,"action":"在原生演示软件中人工复核和交付","actor":"human","component":"Google Slides / PowerPoint","estimated_minutes":null}],"input_type":"提示词、文档或现有演示文稿","output_type":"pptx","manual_effort_level":"low","notes":"官方市场页与官方教程确认其在原生编辑器内工作；模板兼容性和导出保真度待实测。"}
