{"schema_version":"0.3.0-draft","snapshot_id":"deepseek-xunfei-outline-to-deck__2026-09-09","workflow_id":"deepseek-xunfei-outline-to-deck","name":"DeepSeek 研究与大纲＋讯飞智文排版","observed_at":"2026-09-09T00:00:00Z","status":"documented","source_refs":["https://www.bilibili.com/video/BV19VALecEuZ/","https://www.bilibili.com/video/BV1H5FreyEow/"],"steps":[{"order":1,"action":"使用 DeepSeek 完成资料研究、结构设计和文字润色","actor":"mixed","component":"DeepSeek","estimated_minutes":null},{"order":2,"action":"把大纲粘贴到讯飞智文并选择模板生成演示文稿","actor":"mixed","component":"讯飞智文","estimated_minutes":null},{"order":3,"action":"检查事实、文字密度和版式后导出","actor":"human","component":"讯飞智文","estimated_minutes":null}],"input_type":"主题或资料","output_type":"pptx","manual_effort_level":"medium","notes":"两条 B 站来源描述了相同的两段式方法；三分钟等效率主张不作为评测结论。"}
