{"schema_version":"0.3.0-draft","snapshot_id":"claude-skills-html-slides__2026-09-09","workflow_id":"claude-skills-html-slides","name":"Claude Skills 生成可复用 HTML 演示系统","observed_at":"2026-09-09T00:00:00Z","status":"documented","source_refs":["https://www.youtube.com/watch?v=Frrf-26UkNU"],"steps":[{"order":1,"action":"准备并上传有效脚本，确定页面规划和视觉策略","actor":"mixed","component":"Claude","estimated_minutes":null},{"order":2,"action":"让 Claude 生成并迭代 HTML 演示页面","actor":"mixed","component":"Claude","estimated_minutes":null},{"order":3,"action":"把稳定流程写成 Skill 文件以复用规范","actor":"mixed","component":"Claude Skills","estimated_minutes":null}],"input_type":"演讲脚本＋视觉规范","output_type":"web","manual_effort_level":"medium","notes":"YouTube 教程展示的是 HTML 演示而非原生 PPTX；适合网页演示，需单独评价导出和可移植性。"}
