{"schema_version":"0.3.0-draft","snapshot_id":"prezi-ai-dynamic-presentation__2026-09-09","workflow_id":"prezi-ai-dynamic-presentation","name":"Prezi AI 从主题或文件生成动态画布演示","observed_at":"2026-09-09T00:00:00Z","status":"documented","source_refs":["https://prezi.com/ai-presentation-maker/"],"steps":[{"order":1,"action":"输入主题或上传 PDF、Word、PPTX","actor":"mixed","component":"Prezi AI","estimated_minutes":null},{"order":2,"action":"选择受众，审阅结构并生成动态画布演示","actor":"mixed","component":"Prezi AI","estimated_minutes":null},{"order":3,"action":"调整视觉、品牌和导航后分享或导出","actor":"mixed","component":"Prezi","estimated_minutes":null}],"input_type":"提示词、PDF、Word 或 PPTX","output_type":"mixed","manual_effort_level":"low","notes":"输出形态偏动态空间叙事，不能只用传统分页 PPT 指标评价；需增加现场呈现体验维度。"}
