{"schema_version":"0.3.0-draft","snapshot_id":"deepseek-kimi-outline-to-deck__2026-09-09","workflow_id":"deepseek-kimi-outline-to-deck","name":"DeepSeek 生成内容＋Kimi 生成演示文稿","observed_at":"2026-09-09T00:00:00Z","status":"documented","source_refs":["https://www.bilibili.com/video/BV1FkN8esELi/","https://www.bilibili.com/video/BV11UNbehEwo/"],"steps":[{"order":1,"action":"让 DeepSeek 按主题研究并输出演示大纲","actor":"mixed","component":"DeepSeek","estimated_minutes":null},{"order":2,"action":"将大纲交给 Kimi 的演示文稿能力生成并人工调整","actor":"mixed","component":"Kimi","estimated_minutes":null}],"input_type":"主题或资料","output_type":"pptx","manual_effort_level":"medium","notes":"由多条 B 站教程归并出的同类工作流；速度和质量描述尚未独立验证。"}
