{"schema_version":"0.3.0-draft","snapshot_id":"slidesai-text-to-native-slides__2026-09-09","workflow_id":"slidesai-text-to-native-slides","name":"SlidesAI 从长文生成 Google Slides / PowerPoint","observed_at":"2026-09-09T00:00:00Z","status":"documented","source_refs":["https://help.slidesai.io/generate-a-presentation-from-text-aj3nl","https://www.slidesai.io/"],"steps":[{"order":1,"action":"粘贴文章、报告或讲稿并设定受众、语气和长度","actor":"mixed","component":"SlidesAI","estimated_minutes":null},{"order":2,"action":"审阅逐页大纲并选择主题","actor":"mixed","component":"SlidesAI","estimated_minutes":null},{"order":3,"action":"生成后进入 Google Slides、PowerPoint 或网页编辑器继续修改","actor":"mixed","component":"SlidesAI","estimated_minutes":null}],"input_type":"提示词、长文、笔记或文档","output_type":"pptx","manual_effort_level":"low","notes":"官方帮助中心给出完整步骤；字符限制、语言质量和原生元素支持需按套餐与日期实测。"}
