{"schema_version":"0.3.0-draft","snapshot_id":"llm-midjourney-office-assembly__2026-09-09","workflow_id":"llm-midjourney-office-assembly","name":"LLM 写内容＋Midjourney 配图＋Office 人工组装","observed_at":"2026-09-09T00:00:00Z","status":"documented","source_refs":["https://www.bilibili.com/video/BV1t14y1C7P4/"],"steps":[{"order":1,"action":"用大语言模型拆解需求并生成演示结构和文案","actor":"mixed","component":"ChatGPT 或同类 LLM","estimated_minutes":null},{"order":2,"action":"生成或搜索与页面叙事匹配的视觉素材","actor":"mixed","component":"Midjourney 或素材库","estimated_minutes":null},{"order":3,"action":"在 Office 中选择版式并人工完成组装和精修","actor":"human","component":"PowerPoint","estimated_minutes":null}],"input_type":"主题、受众与风格要求","output_type":"pptx","manual_effort_level":"high","notes":"经典分段式 AI 辅助方法，控制力较高但并非一键生成；待用统一任务计时实测。"}
