{"schema_version":"0.3.0-draft","snapshot_id":"deepseek-in-powerpoint-assistant__2026-09-09","workflow_id":"deepseek-in-powerpoint-assistant","name":"在 PowerPoint 内接入 DeepSeek 对话式创作","observed_at":"2026-09-09T00:00:00Z","status":"discovered","source_refs":["https://www.bilibili.com/video/BV1zewDezEZQ/"],"steps":[{"order":1,"action":"按教程配置可在 PowerPoint 中调用 DeepSeek 的扩展或服务","actor":"mixed","component":"PowerPoint / DeepSeek","estimated_minutes":null},{"order":2,"action":"在演示软件内通过指令生成内容、排版或调整元素","actor":"mixed","component":"PowerPoint / DeepSeek","estimated_minutes":null}],"input_type":"自然语言指令＋现有演示文稿","output_type":"pptx","manual_effort_level":"unknown","notes":"来源未在检索摘要中明确扩展名称、权限和复现配置，进入实测前需补齐。"}
