{"schema_version":"0.3.0-draft","snapshot_id":"canva-magic-design-presentation__2026-09-09","workflow_id":"canva-magic-design-presentation","name":"Canva Magic Design 从提示词生成演示文稿","observed_at":"2026-09-09T00:00:00Z","status":"documented","source_refs":["https://www.canva.com/create/ai-presentations/","https://www.youtube.com/watch?v=-tPevV7JgFg"],"steps":[{"order":1,"action":"描述演示主题并让 Magic Design 生成候选草稿","actor":"mixed","component":"Canva Magic Design","estimated_minutes":null},{"order":2,"action":"选择方案，调整内容、素材、品牌和版式","actor":"mixed","component":"Canva","estimated_minutes":null}],"input_type":"提示词","output_type":"mixed","manual_effort_level":"low","notes":"官方产品页和官方 YouTube 教程交叉确认；具体免费额度与导出保真度需按实测日期记录。"}
