{"schema_version":"0.3.0-draft","snapshot_id":"beautiful-ai-guided-deck__2026-09-09","workflow_id":"beautiful-ai-guided-deck","name":"Beautiful.ai 分阶段生成并导出 PowerPoint","observed_at":"2026-09-09T00:00:00Z","status":"documented","source_refs":["https://www.beautiful.ai/text-to-presentation-ai","https://support.beautiful.ai/hc/en-us/articles/12885226948109-Creating-a-presentation-with-AI"],"steps":[{"order":1,"action":"输入提示词、提纲、文档或链接","actor":"mixed","component":"Beautiful.ai","estimated_minutes":null},{"order":2,"action":"在设计前审阅逐页大纲并设定主题与图片风格","actor":"mixed","component":"Beautiful.ai","estimated_minutes":null},{"order":3,"action":"逐页改写、换图并导出 PowerPoint","actor":"mixed","component":"Beautiful.ai","estimated_minutes":null}],"input_type":"提示词、提纲或文档","output_type":"pptx","manual_effort_level":"low","notes":"官方资料确认引导式生成和 PPTX 导出；付费要求、品牌控制和导出后的原生编辑性待实测。"}
