{"schema_version":"0.3.0-draft","snapshot_id":"gamma-prompt-to-pptx__2026-09-09","workflow_id":"gamma-prompt-to-pptx","name":"Gamma 从提示词生成卡片式演示并导出 PPTX","observed_at":"2026-09-09T00:00:00Z","status":"documented","source_refs":["https://gamma.app/","https://help.gamma.app/en/articles/8022861-what-s-the-easiest-way-to-export-my-gamma"],"steps":[{"order":1,"action":"输入主题和语言生成演示草稿","actor":"mixed","component":"Gamma","estimated_minutes":null},{"order":2,"action":"编辑卡片、主题与内容","actor":"mixed","component":"Gamma","estimated_minutes":null},{"order":3,"action":"导出为 PPTX、PDF、PNG 或经 PPTX 转入 Google Slides","actor":"human","component":"Gamma","estimated_minutes":null}],"input_type":"提示词","output_type":"mixed","manual_effort_level":"low","notes":"官方页面确认多格式导出；原生 Gamma 组件转成 PPTX 后的编辑性与视觉保真度需实测。"}
