{"schema_version":"0.3.0-draft","snapshot_id":"presenton-prompt-document-to-pptx__2026-09-09","workflow_id":"presenton-prompt-document-to-pptx","name":"Presenton 从提示词或文档生成可编辑 PPTX","observed_at":"2026-09-09T00:00:00Z","status":"documented","source_refs":["https://presenton.ai/","https://github.com/presenton/presenton"],"steps":[{"order":1,"action":"输入提示词，或上传文档、数据和现有设计","actor":"mixed","component":"Presenton","estimated_minutes":null},{"order":2,"action":"选择模板、模型和部署方式后生成","actor":"mixed","component":"Presenton","estimated_minutes":null},{"order":3,"action":"在画布编辑或导出 PPTX、PDF、PNG","actor":"mixed","component":"Presenton","estimated_minutes":null}],"input_type":"提示词、文档、数据或现有 PPT 设计","output_type":"mixed","manual_effort_level":"low","notes":"官方站点和开源仓库确认；适合加入云端、自托管和模型可替换性专项测试。"}
