{"schema_version":"0.3.0-draft","snapshot_id":"claude-chatgpt-student-deck__2026-09-09","workflow_id":"claude-chatgpt-student-deck","name":"Claude＋ChatGPT 协作制作学生演示文稿","observed_at":"2026-09-09T00:00:00Z","status":"discovered","source_refs":["https://www.youtube.com/watch?v=GAmdad1oVB0"],"steps":[{"order":1,"action":"组合使用 Claude 和 ChatGPT 规划并生成大学课程演示内容","actor":"mixed","component":"Claude / ChatGPT","estimated_minutes":null},{"order":2,"action":"根据教程提示词完成演示文稿并检查","actor":"mixed","component":"未明确","estimated_minutes":null}],"input_type":"大学课程主题","output_type":"pptx","manual_effort_level":"unknown","notes":"检索摘要未披露两个模型的准确分工和最终生成工具，需取得完整字幕后再升级为 documented。"}
